{
  "schemaVersion": "1.0",
  "correlationId": "correlation:task-2.6",
  "taskId": "task:2.6",
  "parentTaskId": "task:forgerail-control-system",
  "phaseId": "phase:contracts",
  "sliceId": "slice:task-2.6",
  "executionAttemptId": "attempt:task-2.6-1",
  "ownerWorkspaceIdentityId": "workspace:echopath",
  "requiredSliceIds": ["slice:task-2.6"],
  "aggregateClosureClaim": false
}
